id,challenge,title,url,assessor,triplet_id,proposal_id,challenge_id,impact_note,impact_rating,feasibility_note,feasibility_rating,auditability_note,auditability_rating,not_valid_rationale,not_valid
4319,F9: Developer Ecosystem,plu-ts Typescript smart-contracts,https://app.ideascale.com/t/UM5UZBzRk,z_assessor_2463,z_assessor_2463-414103,414103,26597,"It's very hard for me as a developer to write a succinct non-technical resume of this proposal, but I'll try it anyway. As far as I understand, the proposal wants to flatten the level of transformations between the smart contracts human readable code to the actual execution code. This has it's benefits, like verifying the contract locally, which really is a big deal. Imagine the human readable code passes through a translator or two, to be understandable for the execution environment, this brings more dependencies, which is more risky in general. What the proposer wants to do is create a more direct path for everyone when writing a dapp and a smart contract to be specific.
I do belive that this is a really ambicious idea, and it would have an impact over the community. I also think it's going to be challenging work, that has a possibility of not being good enough if only a partial subset of functionality is implemented, but there's no way of knowing if it's good enough or not before releasing the solution into the real world. There's no other way around it, but having said that, I do believe it's a worthy effort that needs to be tried out. It's in line with the challenge settings and does provide a solution to a very basic problem, that people just take for granted, but development could be better if this solution is implemented. 
Overall I think this is a great idea and would add a missing piece to the development flow. The impact has a really big potential. I don't have any concerns for this proposal besides the few small things I already mentioned. Good luck to the author.
",5,"The budgeting scheme is sound and I do like the project would be opensource. One thing that I found difficult to confirm were the skills of the proposer. I looked through the code in the github repositories, but there isn't anything implemented that would give any assertion for the level of skill. It's mostly documentation updates and nothing logic heavy that could verify the skills. The youtube channel did have some explanations of haskell tutorials and run through of some specifications, but no actual practical (not-examples) code written, which makes it hard for me to verify the skillset necessary for the implementation of the described proposal. That's not to say, the proposer doesn't have the necessary skills, It's just that I couldn't verify them with the resources and information given.
I do like the idea of expanding the team, once the MVP passes, because such a project would need years to mature and actually be mass adopted and usable in production code. The budget has a good breakdown, although I don't see any reasoning behind the 30k for critical code audit, and how this number came to be. This project is really complex and I find it difficult to believe that 1 person can manage the whole development. As a developer myself I know what's in the relm of possibilities and this would be near impossible, no matter how skilled you are, because it's a time problem not a skill problem. The heuristics are simply too big.
I can appreciete the idea, but overall I'm left uncertain if this is a feasible project or not. I tend to be on the sceptical side, but I choose to give the benefic of the doubt, and say I'm just unsure, giving it a score of 3 for that reason.
",3,"I don't have anything to say about the projects' auditability since if it's an open source project, anyone interested in the progress will be able to follow along using the github repository linked in the proposal. The roadmap is present and anyone can try to follow the milestones set by the author. There's a clear problem and a solution so that's good, butt I think more people should be involved in order to get this project to it's fruition.
Overall an auditable project, but I'd suggest to the author to put themselves in the shoes of the voter and read through the proposal again and polishing it in order to be more understandable for the everyday reader and make it more accessible. I wish good luck.
",5,"thank you sincerely for your assesment; 

I totally understand the concerns expressed in the feasibility section and I'll try to explain my points of view in regard to those here.

I'm sorry you weren't able  to find more information regarding my skill so I understand the overall concerns, I admit that there's in fact not much to build an option on based on what's currently online an publicly available.

regarding the amount chosen for the critical code audit it was the result of breif market research. the amount is an estimation took by a brief exchange of emails with the runtime verification copmpany.

at the time the audit will have to be performed a more in depth research will be done and the company that will perform the audit will be advised about the budget in advance.

Overall glad you see the potential that this proposal has.",
5769,F9: Developer Ecosystem,plu-ts Typescript smart-contracts,https://app.ideascale.com/t/UM5UZBzRk,z_assessor_2615,z_assessor_2615-414103,414103,26597,"I think the proposal given by the team is a very good idea, the issues raised are well defined, in line with the goal of the challenge, the creation of smart contracts is limited to the programming language. haskell program. The proposed solutions have been given and it can be observed that the code that runs on the cardano nodes when validating transactions containing smart contract inputs is not written in Haskell but compiles to Untyped. Plutus Core thanks to a number of . this shows that the proposal can solve some challenging campaigns , the proposal can scale to address future challenges . The approval of the challenge will allow the creation of a tool with the potential to be used by the wider community, which allows the creation of smart contracts, leading to truly decentralized applications. However, there are potential risks that have been raised by the project topic and provided solutions for the cases. I believe the team will develop for the proposal. good luck",4,"The proposal has identified a project completion time of 8 months which is a great thing. The implementation timelines are very detailed, the goals are specific, the project progress is easily checked, 3 weeks of UPLC AST implementation including actual implementation and coverage testing . How the next 4 weeks do , the next 5 to 8 weeks deploy latitude implementation . deploying high level functions and classes from 3 to 4 months. check important codes 1 to 2 weeks progress is easily tracked by the community along with an explanation of the roadmap , so that we have a clear understanding of how the funds are used . In general, the proposed topic has been divided into very reasonable parts, the project spends so that the community knows the time, the amount of money for each item is very detailed I like the project with this budget, everything is the same. part of the process. talk about the team because to start the project and reduce the team cost only give one person the proposal does not give a specific name and tell how the experience is relevant but only gives some useful links such as Twitter account, youtube channel, Github account, HarmonicPool account. Would it be better when the project topic was more detailed about the project team so that the community could see if each person involved in the work was suitable or not? Do you really trust the team to make this project successful? it will be more interesting when they clarify the roles that help the people in the proposal .thanks",3,"The proposal that mentions this project will be open source, can be verified by anyone with an internet connection, updates will be published on the youtube channel and on Twitter, however the proposal is not yet available. project metrics , to let the community know , the project topic needs more detail on this issue . The success of the multi-project is described with the ideal goal of seeing 1 or 2 large projects take advantage of the creation of client-side smart contracts. developer , this developer migration shows that on -chain developers using different languages ​​to create smart contracts will find this option easy to use . I believe the proposal has good forms of audit and these should be made more feature-rich as well as changing approaches. Since this is a new project not a continuation of an already funded project, the community should consider and evaluate the project to get funding soon. Thank you",3,"I have reason to believe the assessment was written by a bot; if that's not the case I want to sincerely apologize to the assessor.

The main content of the assessment is part of the proposal itself copied and pasted and some of the sentences are disconnected,

I'm flagging the assessment and leaving the choice to the veteran assessors.",true
9701,F9: Developer Ecosystem,plu-ts Typescript smart-contracts,https://app.ideascale.com/t/UM5UZBzRk,z_assessor_2940,z_assessor_2940-414103,414103,26597,"The problem described here is that currently making smart contracts is limited to the haskell programming language.
The proposal aims to implement a library capable of constructing and then realizing an AST of Untyped Plutus Core so that it can be submitted with a transaction and processed on-chain. This proposal will have a positive impact on the cardano ecosystem because all developers can use it. The tool that will be created will also be useful for existing dApp developers. This app makes it possible to generate smart contracts on the client side (decentralized applications). The aims of the proposal correspond to the challenges outlined. A number of risks are included in the proposal. It's good that the creator of the proposal has offered a few possible solutions.",5,"The team that will work on this project is 1 person. The performer has demonstrated his relevant experience by including his twitter, youtube channel and GitHub account. The creator of the proposal has chosen a fair salary. The petitioner has also stated that the team could be expanded if it can get funding in later rounds. The budget is clearly defined and is sufficient to complete the project. The time span to complete this project seems sufficient to me. A timetable is in place to complete the work. The time spans are certainly sufficient to properly implement the interim milestones. There is a clear implementation plan in place to make the product usable. The plan describes the means to carry out the project. The technical aspects are included in the detailed plan with the milestones. The risks and challenges are included along with a possible solution for a successful implementation.",5,A roadmap has been included with milestones for a successful realization. A few KPIs are included to measure the success of the proposal. It's good that the updates will be shown on the creator's youtube channel and Twitter profile. The description of the target problem is clearly described. An extensive explanation is provided. This application will be a good solution to solve the problem. It's good that this project is open source. The project is therefore clearly verifiable by all people with an internet connection.,4,"Thank you for your assessment.

it seems to me you went through the proposal and highlighted the points relevant to it.

I personally would have liked some feedback on the idea itself but I assume you were ok with that",
20093,F9: Developer Ecosystem,plu-ts Typescript smart-contracts,https://app.ideascale.com/t/UM5UZBzRk,z_assessor_4062,z_assessor_4062-414103,414103,26597,"Typescript is a friendly and increasingly popular programming language in the programming world.
Programming smart contracts in Typescipt language will help reach a lot of non-blockchain programmers.
The interpretation of Michele's proposal is difficult to understand, especially the explanation of the library's infrastructure.",4,"With Michele's working experience which is shown through Twitter, Youtube, Github channels, the feasibility of the project is very high.
This project also did not have to start from scratch, I noticed the first results and products already.",5,"The interesting point of the project is that not only programming, the leader also uploads videos on youtube.
We can follow the project through 2 channels:
Github: based on programming progress, number of downloads, number of contributions...
Youtube: number of Views, comments, followers",4,"Thank you for your assessment.

I'm really sorry you found the proposal hard to understand I tried to simplify the technical concepts and I'll try to explain them better in the evening the proposal is founded and follow-up community updates have to be made.

I'm really happy to see you had the opportunity to check out the GitHub repository currently under development!

I hope you'll have the occasion to participate to the follow-ups in case of proposal approved in order to keep listening to your feedback",
8596,F9: Developer Ecosystem,plu-ts Typescript smart-contracts,https://app.ideascale.com/t/UM5UZBzRk,z_assessor_2856,z_assessor_2856-414103,414103,26597,"- When the era is being strongly developed, the nature of work is enhanced and the difficulty increases, the introduction of Typescript Smart Contracts. is a great thing.

   - In the proposal, I see that the group has raised the issues that are. Currently, smart contract creation is limited to the haskell programming language; This limits the potential of smart contracts. I found the issues the group raised to be well-suited to the challenge. This proposal desperately needs to scale up to address the challenges in the Challenge.

   - Besides, the proposed topic has also raised a lot of its solutions such as, implementing a library that can build AST of Untyped Plutus Core, so that it can be sent with a transaction and processed on-chain... I find the above solutions to be very suitable for solving the problems in the Challenge.

   - With a presentation of the risks that the project may face. I see the team has also raised some of the risks like at the moment, there is no serialization library, to solve the risk on the proposed topic has come up with solutions to reduce that risk a bit. very reasonable way that is. reimplement ``flat'' from the bottom up, and implement a specialized subset. I think the above solutions are reasonable.",4,"- With section providing a detailed plan, including progress and milestones. Here I see the team has identified a specific milestone. That's going to get the job done over a period of eight months. I think with the above time period is completely reasonable to complete the tasks set out. The progress of the project as well as the goals to be achieved have also been stated very specifically as in the aforementioned proposal.

    - In the section provide detailed budget breakdown. With a total budget of $105,840 and already expenses for things like. project development, data warehouse maintenance, and some other costs. I find such cost divisions to be reasonable.

    - About providing detailed information about the people who will work on the project. Here I see the new group raised one member. Through research, I found this member's working capacity as well as experience is very good. This member's identity is also easily verifiable.",4,"- With a description of what you will measure to track your project progress. I see 2 main indicators yet that is, the project will be open source, so anyone with an internet connection can verify it. and updates will be published on my Youtube channel weekly. I find such indicators to be very complete and reasonable. However, it is not easy for the community to track these indicators.

    - In the Success section of this project what does it look like? there have been few successes yet such as will see 1 or 2 large projects taking advantage of client side smart contract generation, and developer adoption of this tool. I find the successes cited to be very relevant to the challenge.


    - Regarding funding. This is a new project that has not been funded, but as a PA I find this proposal very good and meaningful. I hope the proposal will be successful.",4,"I'm glad you overall liked the idea

given the average vote I was expecting something you'd like to see implemented, but I wasn't able to find any of such feedback;

If is it ok for you, feel free to reach me out in case you missed to report these feedbacks.

overall thank you for your assesment.",